,,经度,纬度
车公庄西路中国水利水电研究院门前人行灯东向西,1811,116.3322486,39.93806914
知春路学知桥至知春路西口段,1882,116.3583361,39.98191296
良白路与京沈路交叉口东侧,1825,116.6435524,40.17194984
鼓楼南街昌平镇商业街东口至政府街口段,1858,116.236109,40.22774404
京港澳高速宛平桥上西向东,1754,116.4133837,39.91092455
顺平路与左堤路交叉口西侧东向西,1772,116.7072833,40.13121462
金城坊北街金树路口至金城坊北街北口段,1710,116.3677178,39.92424222
京开高速天宫院收费站北进京,1710,116.3309609,39.67746164
老营房路,1750,116.2901137,39.96789242
海淀中街与丹棱街交叉口西南角,1734,116.3175221,39.98492725
供电局路口东向西,1792,116.459583,39.92650621
富强路,1723,116.3452606,39.74326743
朝阳路杨闸环岛,1761,116.6062607,39.91792709
京加线187公里700米,1755,116.4133837,39.91092455
杏石口桥东 东向西,1786,114.5134711,37.07374996
大广高速北京方向1123km 090m,1762,116.484938,39.89964808
京沪高速北京方向292公里 100米,1760,116.484938,39.89964808
园博园南路地铁张郭庄站东向西,1768,116.2023162,39.85859135
北苑路大屯路东口南北向南,1729,116.4238885,40.00914026
二环主路积水潭桥西公交港湾 内环,1751,116.4533319,39.94657216
北京路与昌盛街路口,1758,116.8354809,40.19760509
冠城路檀山路电子警察路口,1759,116.4133837,39.91092455
广渠门桥西 东向西,1774,116.4514406,39.89945994
钟吾路与北京路交叉口,1716,116.3871828,39.80614577
北京市石景山区衙门口桥东天桥 东向西,1749,116.2296127,39.91135381
胜利办事处其他道路起点至终点段,1782,116.4892575,39.98129624
顺平南线河南村环岛西侧 东向西,1784,116.702564,40.11384603
西大望路大郊亭中街西口至平乐园段,1785,116.4880173,39.88824662
北太平庄路北太平桥北南向北,1762,116.3767578,39.97586785
西什库大街北向南,1728,116.3865999,39.93397233
1号航站楼出发层,1713,116.403693,39.7972801
六环路马驹桥三号桥外环,1763,116.5702943,39.75463246
大红门路大红门路北口至大红门路口段,1710,116.4088498,39.85738592
北京路北京路万大街路口0米,1728,116.3712819,40.01256792
杨镇办事处其他道路起点至终点段,1722,116.4892575,39.98129624
西沙桥下 北向南,1755,116.2512036,40.17074693
玉泉营桥北由北向南,1790,116.3516556,39.85587599
京藏高速北京方向230公里500米,1723,116.3914024,39.97366913
107国道葫芦垡桥北北向南,1755,116.2165151,39.70274368
京台高速859公里500米,1741,116.4133837,39.91092455
北坞村路与闵庄路交叉口南侧 北向南,1647,116.2689591,39.97961689
东二环东直门桥北 外环,1648,116.4406803,39.94734935
三环路六里桥北 北向南,1654,116.3180633,39.89060665
九德路台湖南口南 南向北,1699,116.6644215,39.83707804
北京东路云岩区民政局路段,1693,106.770948,26.59779395
便西路：北京中路至中山路路段,1640,116.2476463,40.23793851
京港澳高速宛平桥东入口 西向东,1661,116.2183909,39.84590329
燎原路：北京东路至江津东路路段,1654,106.2655976,29.29588437
莞佛高速,1699,116.4133837,39.91092455
建材城西路与建材城中路路口南侧,1681,116.3710679,40.06680632
北京路广州南路路口,1695,116.3871828,39.80614577
宏福西路与兴华大街路口西向东,1657,116.3392822,39.73841155
玉桥办其他道路起点至终点段,1640,116.4892575,39.98129624
普惠西街北口南向北,1669,116.3109872,39.91584487
永定门外大街永定门桥至木樨园桥段,1663,116.4101938,39.86042553
新兴桥南南向北,1680,116.3168967,39.91199076
沙子口路南口北由南向北,1652,116.4120425,39.86737946
丁章胡同羊肉胡同西口至丁章胡同西口段,1648,116.3709668,39.92876381
四环路万泉河桥内环,1665,116.3072426,39.99055766
中海紫御公馆南侧路中海紫御公馆南侧路东口至中海紫御公馆南侧路西口段,1614,116.3969846,39.87645503
南三环辅路右安门南桥东侧地下停车场入口全方向,1666,116.3749144,39.86232558
北清路与岭上路路口,1669,116.4709653,40.10992583
新文化街,1668,116.5488312,39.90439657
速航路进海天六路北约300米,1667,116.1674419,39.81502151
京哈高速北京方向108km+300m,1688,116.484938,39.89964808
天北路与馨园二路交叉口 东向西,1681,116.5375938,40.25411916
钻探公司路口,1622,116.4133837,39.91092455
六环路徐庄桥南外环,1679,116.1273395,39.81805518
中关村大街中关村南路西口,1694,116.4133837,39.91092455
鲁谷西路与石景山路交叉口北向南,1667,116.3039916,39.80523603
阜石路高架晋元桥东龙门西向东,1620,116.2187919,39.93035357
梅市口路与张仪村路交叉口西东向西,1642,116.2376789,39.87826467
三环主路静安庄公交港湾内环,1616,116.4533319,39.94657216
北沙滩桥北过街天桥南向北,1664,116.9933992,36.68406787
三环主路安贞桥东公交港湾内环,1641,116.4142988,39.97529198
时代花园南路时代花园南路东口至时代花园南路西口段,1610,116.208394,39.92424298
北京中路：江汉南路至红门路路段,1695,116.356794,39.79439096
清源路与兴丰大街交口 东向西,1693,116.3459467,39.7483773
草桥社区文化中心西侧路南向北,1654,116.643997,40.15012648
西直河桥北由南向北,1594,116.5376301,39.84486047
姚家园路朝阳公园桥东东向西,1575,116.4963341,39.93970825
望园路与望园北路交叉口 北向南,1550,116.2931867,39.87460365
玉泉营桥北由南向北,1552,116.3516556,39.85587599
湖光北街湖光北街口至湖光北街宏泰西街西口段,1515,116.4744457,40.00728985
五环路北苑桥西天桥 外环,1520,116.4215934,40.02943259
方庄路北京路灯管理中心南全方向,1515,116.4464613,39.87401231
北京路-黄海三路电警,1586,116.3871828,39.80614577
京沪高速上海方向234公里1车道,1562,116.484938,39.89964808
北京东路与甜蜜小镇下匝道交叉口100米,1554,116.4133837,39.91092455
裕民路裕民路东口至裕民路西口段,1552,116.3980725,39.97960389
南环路,1567,117.3091505,40.18058239
京平高速夏各庄检查站进京,1520,117.210242,40.13415308
紫竹院路紫竹桥东西向东,1521,116.3059652,39.95208627
三环路洋桥东西向东,1536,116.4153365,39.97535071
四环公益东桥 北向南,1578,116.3939533,39.83908849
四环路马家楼桥东向南匝道,1599,116.435777,39.83818743
铁医路东向西,1517,116.3251512,39.90632894
复兴路采石南路北口至玉泉路口段,1590,116.259389,39.91348506
文慧园路文慧园路口,1578,116.3689556,39.95527841
雍和宫大街,1512,116.4230963,39.95143845
中关村北大街中关村一桥至杨柳路西口段,1558,116.1947443,39.94244235
燕郊迎宾路与燕新大街交叉口,1588,116.8202516,40.37055746
欣宁街或宏大路,1544,116.3353811,39.79372778
未来科学城大道与岭上路路口,1565,116.4828995,40.12561375
三元东桥南由东向西,1553,116.4663247,39.96001905
衙门口桥东天桥 东向西,1576,116.2162088,39.8984053
北五环90公里处 东向西,1565,116.4133837,39.91092455
德上高速035公里550米,1548,116.4133837,39.91092455
京开高速马家楼桥下 出京,1569,116.349851,39.83968607
六环路徐庄桥南 外环,1519,116.1273395,39.81805518
赵公口桥北 由南向北,1542,116.3110981,39.99466816
G18578公里000米至G251248公里420米,1545,116.4133837,39.91092455
西直门外南路东鼎市场前西向东,1559,116.3526563,39.94290243
北苑路双营路西口至春华路西口段,1584,116.4215148,40.04704575
海淀北一街与海淀西街交叉口东北侧电警杆,1550,116.3160542,39.98769467
华山道与泰华路交叉口,1569,116.4133837,39.91092455
北京路与向阳路交叉口,1590,116.4080798,39.78811731
东直门北小街北新桥三条东口至针线胡同西口段,1537,116.5041985,39.99326808
三环路和平西桥东 东向西,1532,116.424432,39.97535721
紫月路紫月路北口至容达路口段,1544,116.4811764,40.02508793
鲁谷大街鲁谷大街北口至张仪村路北口段,1579,116.2390473,39.89612994
京哈高速北京方向K125 900M,1589,116.484938,39.89964808
老君堂中路与康化路交叉口北向南,1555,116.5155283,39.84587536
阜永路口 东向西,1590,116.271044,39.93039611
三环主路安贞桥西公交港湾西向东,1526,116.4142988,39.97529198
西单路口 北向南,1434,116.4133837,39.91092455
朝阳北路南侧物资学院路口东侧公交车站,1490,116.644583,39.93696706
通胡路,1433,116.716718,39.92366282
姚家园路朝阳公园桥东 东向西,1425,116.4869217,39.94847809
青春路泉河派出所路口,1469,116.6364378,40.3335347
广源高速48公里180米,1435,116.4133837,39.91092455
北京路健康路口,1474,116.637819,40.38714899
昌平区立汤路龙德紫金西非机动车道,1457,116.418596,40.10261606
南苑路三营门路口 北向南,1470,116.4085205,39.81418664
奥林西桥南由北向南,1439,116.3911516,40.03082332
宣武门西大街长椿街口西向东,1411,116.370295,39.9021601
四环路公益西桥西天桥 东向西,1447,116.435777,39.83818743
宏福路或兴海北街,1494,116.340877,39.79978308
北清路与温阳路交叉口南向北,1449,116.1686799,40.0748023
四环路窑洼湖桥外环,1417,116.435777,39.83818743
西站北广场西站北广场西二口至西站北广场西一口段,1414,116.327737,39.90246308
崇文门外大街东茶食胡同东口至磁器口段,1482,116.4253109,39.89928759
通顺路北窑上桥南 南向北,1452,116.6841298,40.00955867
北京路金川路十字西20米,1464,116.3871828,39.80614577
光辉桥东由东向西,1466,116.484426,39.91103986
定慧寺路口东,1492,116.4133837,39.91092455
金城坊南街金树路口至金城坊南街南口段,1434,116.369652,39.92808411
二环路白纸坊桥北 内环,1457,116.3667527,39.8844384
永定路永定路口至北太平路口段,1430,116.2710265,39.91006512
京承高速望和桥南第一天桥进京,1456,116.3620596,39.8942487
圆明园西路绿苑西路西口至中发百旺段,1492,116.283004,40.0353251
玲珑路玲珑西口至玲珑路公交场站口段,1499,116.3005031,39.93861025
京承高速8.4公里处 进京,1446,116.4133837,39.91092455
滨河东路康乐街南50米（人行天桥）,1448,116.7288199,39.88270197
京沪高速北侧1204km约390米,1490,116.336456,39.88992008
霞公府街,1463,116.4140014,39.91559814
北京市西城区新街口外大街冰窖口胡同西口北 北向南,1473,116.38172,39.95599008
二环路阜成门桥 内环,1480,116.3635083,39.92850287
望京西路利泽西二路北口,1486,116.4693193,40.0142474
北新华街东绒线胡同口北 南向北,1488,116.3903053,39.91128181
北京市朝阳区京承高速主收费站南 出京,1449,116.5977906,39.91529604
崇文门外大街崇文门至红桥段,1422,116.4334267,39.90200574
莲花桥东龙门 由西向东,1462,116.3162218,39.90234653
阜通西大街阜通西大街至望京街口段,1497,116.4892294,39.9984016
京台高速1366公里950米,1483,116.4133837,39.91092455
京通快速路城铁四惠东站出京,1491,116.3018716,39.90750952
南湖路与北京南路,1398,116.3582218,39.73471803
北京西路与福州街交叉口,1330,116.4133837,39.91092455
张承高速C53KM 300M,1386,116.4133837,39.91092455
西直门外南路东鼎市场前 西向东,1347,116.3526563,39.94290243
天华东路天华东路北口至北环西路与天华东路路口段,1337,116.5037779,39.80761648
北苑路康斯丹郡门口 由北向南,1391,116.4257967,40.02197025
海河路与北京路路口100米,1330,116.3871828,39.80614577
团王公路与团唐公路交口,1380,111.1876282,36.98787267
京新高速上地桥上 进京,1355,116.3078202,40.04550667
衙门口桥东天桥 西向东,1386,116.2162088,39.8984053
玉泉营桥南向西匝道,1373,116.4133837,39.91092455
崇文门外大街瓷器口路口北 南向北,1380,116.4254623,39.89913153
晋元桥东天桥 西向东,1344,116.2202144,39.93149497
东四北大街东四六条西口至魏家胡同东口段,1393,116.4235571,39.93925001
顾家庄桥南路口南 由北向南,1337,116.4488434,39.85336562
京台高速763公里260米,1337,116.4133837,39.91092455
官园桥东天桥由西向东,1392,116.4133837,39.91092455
丽园路,1374,116.3260803,39.75598948
四环路窑洼湖桥 外环,1376,116.4963954,39.88931265
京广桥西由东向西,1382,116.4682823,39.92668616
建国门外大街建国门桥东辅路 西向东,1337,116.4570162,39.91420177
金地朗悦十二中西侧路口东南角,1349,116.1972987,39.73824839
京藏高速北京方向77KM_350M,1363,116.3914024,39.97366913
兴盛街与北程庄交口 南向北,1324,116.3150496,39.75325314
六环路六合北桥 外环,1337,116.1273395,39.81805518
乌（拉泊管理站）-板（房沟乡）3公里400米,1313,116.4133837,39.91092455
奥林西桥南 由北向南,1336,116.3911516,40.03082332
北京市丰台区榴乡路榴乡桥至刘家窑桥段,1389,116.4292102,39.83824685
112国道1121公里200米(1121KM 200M),1310,116.2240128,40.26879927
北京路气象站,1320,116.3871828,39.80614577
园博大道杜家坎环岛北侧铁道桥 南向北,1381,116.2154735,39.84920009
科慧大道科慧大道与广德中巷路口至科慧大道与天宝北街路口段,1399,116.4917939,39.80381918
三环路花园桥北出口北向南,1340,116.3165417,39.93830223
普惠西街南口南向北,1368,116.3080156,39.93113557
科荟路科荟路西口至科荟路林萃路口段,1347,116.3765692,40.02335219
火寺路与顺于路交叉口南向北,1368,116.560805,40.13725539
京承高速71.2km进京,1360,116.4133837,39.91092455
桦皮厂胡同北口南由南向北,1367,116.3656205,39.94861525
昆明湖南路,1348,116.2800702,39.97050197
右安门桥下由南向北,1316,116.3707252,39.87514075
红军营南路红军营南路北苑路口至红军营南路清苑路口段,1354,116.4362168,40.03864081
月坛南街阜成门南大街至三里河路段,1322,116.3488135,39.92080116
机场高速1.3公里处出京,1386,116.4133837,39.91092455
京周路24公里,1389,116.0204417,39.70617809
五环肖家河桥匝道东向南,1315,116.4133837,39.91092455
南顶路南顶路东口至南顶路西口段,1323,116.428497,39.84855025
经海路与科创街交叉口南向北,1326,116.5586994,39.80241499
京藏高速11.8公里处进京,1297,116.3782158,40.00556402
阜成门外大街阜外十字街口西东向西,1287,116.3503497,39.92883137
中关村大街四通桥至中关村一桥段,1292,116.327758,39.97280953
东兴隆街东兴隆街口至花市西口段,1216,116.4359351,39.90331341
京平高速与机场第二高速联络线出京方向2号点出京,1287,116.7966889,40.04542865
虎坊桥路口西向东,1215,116.3936533,39.89443879
北京市海淀区京新高速上地桥上 进京,1215,116.3078202,40.04550667
武定侯街金融街口至阜成门南顺城街北口段,1234,116.3531968,39.9172929
幸福街路口北向南,1282,116.7943276,40.37247698
大瓦窑桥西 东向西,1284,116.2454811,39.86319266
杏石口桥东西向东,1222,116.221482,39.96196338
赵公口桥北由南向北,1265,116.4206469,39.86331105
京开高速双源桥 出京,1271,116.3340378,39.7058191
东外大街新风路口至人民商场路口段,1234,115.981662,40.46463601
北京市通州区梨园办事处其他道路起点至终点段,1267,116.6634154,39.91601712
朝阳北路朝阳北路黄渠村口至朝阳北路三间房东路北口段,1227,116.5745384,39.93119228
胡各庄乡其他道路0公里,1243,116.4133837,39.91092455
梅市口路五环路东侧西向东,1228,116.2526708,39.88525563
魏永路与民族小学路口 西向东,1235,116.3314267,39.67272297
六环路阎村桥北 外环,1288,116.102447,39.72609092
昌平区立汤路东三旗路口北,1299,116.4266631,40.09940551
南外环由西向东珠江路出口,1277,116.4133837,39.91092455
承赤高速1080KM+300M 北京方向,1213,116.484938,39.89964808
学清路北口 北向南,1227,116.4144075,39.97357144
京新高速箭亭桥北 进京,1220,116.4133837,39.91092455
悦盛路3号院10号楼处,1248,116.1909261,39.76813829
信息路与上地四街交叉口西向东,1273,116.3159411,40.0443046
东二环东直门桥北 内环,1295,116.4406803,39.94734935
北京路与解放路,1272,116.3871828,39.80614577
顺平路与左堤路交叉口西侧 东向西,1249,116.7072833,40.13121462
通燕高速20.9公里处 进京,1287,116.4133837,39.91092455
北京南站南口北 由北向南,1286,116.3854879,39.87128024
(电)北京东路上海北路口,1239,116.4133837,39.91092455
二广高速483公里860米,1250,116.4133837,39.91092455
姚家园路石佛营路北口东 东向西,1293,116.5083786,39.94229859
奥林西桥南 由南向北,1226,116.3911516,40.03082332
卧龙路与北京路交叉口,1256,116.3871828,39.80614577
台基厂路口 南向北,1299,116.4179308,39.90669363
京港澳高速公路北京方向70公里,1250,116.1722395,39.78353291
华信医院南侧路西口,1238,116.501489,39.97165706
北京西路与合肥路交叉口,1284,116.4133837,39.91092455
广义街槐柏树街至广安门内大街段,1263,116.3675149,39.89513324
太阳宫桥北北向南,1293,116.4375658,39.97581448
供电局路口 西向东,1255,116.459583,39.92650621
常青路,1288,116.2784602,39.9661692
仰山桥南 由北向南,1261,116.4133837,39.91092455
永安里路口由西向东,1273,116.2389319,40.21711932
北蜂窝中路北蜂窝中路东口至北蜂窝中路西口段,1231,116.33581,39.90616617
复兴门外大街白云路北口西西向东,1279,116.3531968,39.9172929
徐宋路0公里,1299,116.7311082,39.94800699
东坝中路与朝新大街交叉口北向南,1220,116.5536427,39.96648202
北京北路,1279,116.4500007,39.92751531
机场高速路进京温榆桥上北向南,1276,116.5808815,40.04043137
青年路朝阳北路口至青年路大悦城口段,1223,116.5248195,39.93077227
北京路与济南路（卡口）,1297,116.3871828,39.80614577
阜成门桥东西向东,1287,116.3635083,39.92850287
三旗百汇北门西向东,1262,116.352909,40.0685381
阳光西街阳光西街南口至阳光西街北口段,1270,116.2925284,39.91729865
赵公口桥北 由北向南,1282,116.3110981,39.99466816
朝阳大桥_西向东,1234,116.4133837,39.91092455
乌鲁木齐市新市区高新街高新街北三巷路口,1220,87.57959292,43.8613553
石榴园路宋庄交通枢纽 东向西,1170,116.436006,39.85090006
G210与江海路北侧,1121,116.336456,39.88992008
三环主路马甸桥东公交港湾 内环,1149,116.3883075,39.97433694
南外环2KM5米,1120,116.4133837,39.91092455
右安门桥下 由南向北,1115,116.3707252,39.87514075
顾家庄桥南路口南由南向北,1166,116.4488434,39.85336562
北长街北口 北向南,1166,116.3976478,39.92327947
南磨房路南磨房路52路口总站口至平乐园段,1114,116.4880173,39.88824662
翠柳大街苏庄南口至规划十路路口段,1117,116.1301722,39.72913244
京昆高速698公里650米,1195,116.4133837,39.91092455
园博园南路地铁张郭庄站 东向西,1189,116.2023162,39.85859135
丛林东路南口南北向南,1171,116.132726,40.24067303
翠屏西路怡乐北街路口南 北向南,1189,116.4768005,39.76277237
陶然桥北 由南向北,1144,116.394372,39.87739939
景华街南街东口西 由东向西,1159,116.4133837,39.91092455
西五环路杏石口桥北第一过街天桥  北向南,1150,116.2192254,39.91955879
103国道土桥新桥西 西向东,1118,116.4133837,39.91092455
展览馆路阜成门外大街至西直门外南路段,1181,116.3451806,39.95270992
京哈高速270公里800米,1130,116.4133837,39.91092455
京开高速天宫院收费站北 进京,1117,116.3309609,39.67746164
金融大街与成方街交叉口 北向南,1192,116.3658156,39.91442113
通顺路与顺祥街交叉口 北向南,1110,116.8844155,40.35684228
府学路与水库路路口西侧 东向西,1183,116.2685259,40.22802219
101国道六元桥南 南向北,1115,116.6043802,40.14749007
北京市西城区陶然桥北 由南向北,1197,116.394372,39.87739939
北京中路与南京大街路口,1170,116.4133837,39.91092455
三环主路西坝河公交港湾 外环,1168,116.4471205,39.9713049
物资学院路西侧地铁6号线D口前,1168,116.6459395,39.92927246
北京市大兴区德贤路旺兴湖桥南过街天桥 南向北,1153,116.442755,39.82035305
健翔桥南过街天桥南向北,1193,116.3858917,39.99359268
万柳东路万柳东路南口至万柳东路北口段,1178,116.3029083,39.97784459
万寿寺路,1123,116.3216388,39.95148359
交道口东大街交道口路口至北新桥路口段,1114,116.4347069,39.95283824
龙泉镇其他道路龙泉镇其他道路起点至龙泉镇其他道路终点段,1128,116.4892575,39.98129624
白纸坊桥东西向东,1134,116.3558441,39.88216604
安乐林路沙子口路口至蒲黄榆路口段,1120,116.4238757,39.87644984
苹果园街道其他道路阜石路至西井路段,1185,116.2006506,39.93786052
双营路秋实东街南口至双营路与清苑路交叉口段,1191,116.4322772,40.04752933
桥梓镇其它道路桥梓镇至桥梓镇段,1124,116.580546,40.29609119
南关西路长虹小区北口至南关西路西口段,1193,116.1445013,39.73107644
月坛西街月坛南街至月坛北街段,1186,116.3576744,39.92545339
北京路乌伊路口,1113,116.3871828,39.80614577
二环路白纸坊桥北内环,1165,116.4363126,39.87723827
西单路口西向东,1175,116.4133837,39.91092455
新兴桥东天桥由西向东,1148,116.3168967,39.91199076
闹市口西向东,1124,116.369806,39.91313115
厂洼街,1126,116.3096721,39.95947833
京平高速与机场第二高速联络线出京方向1号点出京,1156,116.7966889,40.04542865
天北路与兆丰二街交叉口 南向北,1196,116.5375447,40.22449726
阜安东路阜安东路国风小区口至阜安东路宏泰东街口段,1147,116.4930164,40.00042828
良乡东路　揽秀北大街路口至良乡东关路口　段,1163,116.1541372,39.73737041
供电局路口西向东,1188,116.459583,39.92650621
马家堡路南口北由南向北,1147,116.3861288,39.85361282
六环路火寺路出口西 西向东,1147,116.559472,40.15361008
白马路与火寺路路口西向东,1194,116.5668742,40.18220385
北京路与信臣路交叉口,1145,116.3871828,39.80614577
劲松桥西天桥由东向西,1118,116.4680232,39.88999636
兴贸南街马团路口 西向东,1163,116.5831336,39.76190233
京藏高速1633公里900米,1114,116.3782158,40.00556402
京良路0公里,1162,116.2804125,39.77677303
拱辰大街医院路口至乔家胡同东口段,1156,116.1485332,39.74223193
四环定慧桥下匝道南向西,1083,116.280138,39.93142512
化工桥北由东向西,1076,116.550639,39.8510063
新兴桥东天桥由东向西,1061,116.3168967,39.91199076
四员厅街车站路至新华南路段,1011,116.6641279,39.90702902
南环路与东环路路口北侧 南向北,1011,116.2471191,40.21876855
古城南路与古城小街交叉口南向北,1071,116.1956143,39.91695243
裕民中路北三环中路至北土城西路段,1087,116.3944933,39.97830813
焦庄路口西向东,1092,116.2825883,39.87829793
温泉路环山村口至白家疃路口段,1086,116.2155223,40.04058621
西环路,1081,116.8593121,40.35721896
金盏路金盏路,1079,116.5854451,40.00721645
北部湾路北京路口至四川路口000米,1090,116.512885,39.84746928
南河沿路口东向西,1046,116.4133837,39.91092455
仰山桥南由北向南,1055,116.4133837,39.91092455
北京路-黄海二路反向卡口,1039,116.3871828,39.80614577
马家堡东路与角门南路交叉口南侧 全方向,1061,116.3932379,39.84635949
北京大街广州路20米,1071,116.4133837,39.91092455
兴华桥下由南向北,1085,116.3367838,39.78516731
和平里西街和平里西街滨河路口至雍和家园北口段,1057,116.4265377,39.95670693
金街南路（府前街至站前街）路段2号点位,1018,116.6599183,40.1339588
高塔街第四幼儿园东西向东外侧车道,1049,115.9980563,40.47407118
长阳京投港门口路口处,1046,116.2207557,39.76920381
新兴桥南北向南,1055,116.3168967,39.91199076
天北路与安华街交叉口南向北,1087,116.5394879,40.0873612
莲花河路京九线铁路至广安门外大街段,1041,116.3508909,39.88379256
京开高速辅路新发地桥下进京,1091,116.3491795,39.81728778
朝阳路八里庄路南口至甘露园北口段,1096,116.5181259,39.9227166
西客站北广场西天桥东向西,1094,116.327737,39.90246308
北京西路进铜仁路东约5米,1095,116.4133837,39.91092455
北京路路段,1058,116.3871828,39.80614577
京加路57.5公里处北向南,1051,116.66616,40.69822702
火车站镇北京路4公里500米,1078,116.3712819,40.01256792
北京路-南坦大街,1035,116.3871828,39.80614577
六环路酸枣岭桥西 西向东,1012,116.4929892,40.16020148
北京路与贵州大道交叉口,1080,116.3871828,39.80614577
木樨园桥北百荣世贸商城前 由南向北,1036,116.4047815,39.8672384
物资学院地铁站南侧东西向东,1074,116.1959416,39.92840143
安立路立军路东口北 南向北,1067,116.4185507,40.05397135
融商六路马驹桥东站西北向南,1029,116.5782122,39.76850979
马朱路与长留南路交口南向北,1060,116.5871318,39.70329465
潍坊_G18荣乌高速371KM 000M_上行,1048,116.4133837,39.91092455
京港澳高速房山梨园桥北南向北,1098,116.3110981,39.99466816
新春路与北京大道交叉口,1051,116.4133837,39.91092455
京藏高速上清桥南过街天桥 南向北,1085,116.4133837,39.91092455
京承高速望和桥南第一天桥 进京,1053,116.3620596,39.8942487
夏都大桥北 南向北,1080,116.4133837,39.91092455
广渠路高碑店污水处理厂门口 由东向西,1046,116.5347841,39.90589662
联想桥南天桥由南向北,1025,116.3416632,39.97315595
老君堂桥北 由南向北,1066,116.4133837,39.91092455
