,,经度,纬度
北京路与赣江路,1094,116.3871828,39.80614577
京津高速127公里000米北京方向-京津高速92公里650米北京方向,1033,116.484938,39.89964808
百子湾路百子湾路苹果社区西侧路北口至五福馆路口段,1016,116.477152,39.90452404
同仁东路北口 北向南,1041,116.4267349,39.86072403
兴盛街或乐园路,1079,117.0591719,40.21257977
右安路南口西向东,1094,116.3482966,39.83152806
丰葆路与丰茂南路交叉口 南向北,1072,116.2963616,39.82903731
北苑路康斯丹郡门口 由南向北,1070,116.4257967,40.02197025
机场高速路进京苇沟入口指示牌处 北向南,1090,116.3028531,39.78310842
水源路万象汇,1067,116.8420558,40.36133703
奥林东路南天桥 由南向北,1066,116.4091767,40.02118719
101国道83公里荆子峪村进京,1049,116.2240128,40.26879927
顺密路唐指山村路段南向北,1019,116.8055364,40.26927505
陈马路东江头村东侧路段北向南,1044,116.7849557,40.16768338
顺密路唐指山村路段北向南,1074,116.8055364,40.26927505
肖家河桥南 南向北,1021,116.2898282,40.02042506
京台高速835公里500米,1024,116.4133837,39.91092455
六环路仁和桥内环,1011,116.6285174,40.11934396
木燕路田家营村路段 北向南,1086,116.8064201,40.11114512
京港澳高速439km+900m港澳方向000米,1082,116.3069375,39.81933093
京藏高速西沙桥 南向北（辅路）,1030,116.2512036,40.17074693
六环路徐庄桥南 南向北,1047,116.1273395,39.81805518
和平里街道滨河路旧鼓楼外大街滨河路口至东土城路滨河路口段,1030,116.400029,39.95895838
大红门南路大红门南路北口至大红门南路南口段,1029,116.4012875,39.82545194
京藏高速北京方向135公里0米,988,116.3914024,39.97366913
北京大街南京大街20米,915,116.4133837,39.91092455
机场高速辅路南皋路口,973,116.510591,40.00797604
五环肖家河桥匝道 东向南,968,116.4133837,39.91092455
唐通公路与新钟公路交口(0009KM 300M),952,111.1876282,36.98787267
马家堡东路角门路口 南向北,988,116.3928359,39.8513916
京哈高速沈阳方向108公里 450米,935,116.3069375,39.81933093
济广高速557公里,946,116.4133837,39.91092455
泉旺路与富民道交口,922,111.1876282,36.98787267
上海路(北京西路至广州路路段),941,116.4133837,39.91092455
采石北路金沟河路中口至阜采路口段,977,116.2663401,39.93035911
田村东路田村东路口至田村东路北口段,992,116.2545706,39.9400547
南河沿路口西向东,935,116.2825883,39.87829793
沈海高速921公里700米,950,116.4133837,39.91092455
阜成门外大街阜外十字街口西 东向西,963,116.3503497,39.92883137
东四西大街美术馆路口至东四路口段,926,116.4162466,39.93393322
西罗园路南口北由北向南,917,116.3991752,39.86711097
Ｇ１京哈高速辅路五方桥区至王四营桥段五方桥区至王四营桥下路口段,929,116.539447,39.87472906
大羊坊桥下 由北向南,965,116.5159738,39.82836586
迎宾街与福苑里交口,926,117.0938007,40.14226043
欣旺大街宏福路交口北向南,963,116.3461652,39.80134642
小街桥南北向南,940,116.4319222,39.95573837
京开高速路玉泉营南侧天桥北向南,938,116.3490866,39.8525673
仰山桥南 由南向北,977,116.4133837,39.91092455
六里桥东由西向东,941,116.3180633,39.89060665
京通快速路城铁传媒大学站东向西,925,116.3018716,39.90750952
府前中街与光明街交叉路口西侧   西向东,959,116.6631021,40.13618823
京东路：北京路至天津路路段,961,116.3871828,39.80614577
四通桥南天桥由北向南,962,116.3278433,39.97279942
北京西路与商城西路交叉口,980,116.4133837,39.91092455
烟台路与北京路路口,981,116.3871828,39.80614577
鲁谷东街北京景山学校远洋分校门前全方向,950,116.243981,39.90495508
北京东路与工程大学交叉口,986,116.4133837,39.91092455
六环路马驹桥东内环,954,116.1273395,39.81805518
庆园街地税路口东东向西内侧车道,919,116.6411649,40.31837534
京港澳高速344km+010m港澳方向至京港澳高速373km+050m港澳方向,938,116.3069375,39.81933093
马家堡街道其他道路起点至终点段,942,116.377011,39.85132111
通燕高速北运河大桥出京,945,116.7390546,39.89474069
中山东街（光明街至右堤路）路段2号点位,974,116.6604229,40.14326423
天竺办事处其他道路起点至终点段,954,116.4892575,39.98129624
芦花路,977,116.2968757,39.80080228
德贤路旺兴湖桥南过街天桥南向北,952,116.442755,39.82035305
高梁桥斜街高梁桥北小桥至大慧寺东口段,947,116.3400154,39.9579691
京开高速西红门南桥上进京,913,116.4133837,39.91092455
朝阳公园南路朝阳公园桥西东向西,992,116.4869217,39.94847809
前门东路南口东向西,910,116.4075145,39.90274998
青年路青年路大悦城口至青年路国美第一城口段,929,116.5178769,39.94020289
京开路玉泉营桥南南向北,999,116.3516556,39.85587599
金沟河路金沟河路口至金沟河路中口段,929,116.2695897,39.92388892
北四环西路学院桥至火器营桥西岸段,984,116.2949436,39.97209852
三环主路马甸桥东公交港湾外环,926,116.3883075,39.97433694
玲珑路恩济东街口至慈寿寺桥段,982,116.3005031,39.93861025
园博大道杜家坎环岛至园博大道与北宫路交叉口段,924,116.2154735,39.84920009
玉泉路北航医学院门前人行灯南向北,955,116.2596361,39.92188361
中关村北大街厢白旗桥南北向南,960,116.1947443,39.94244235
小屯路北段东侧（莲玉桥南）南向北,956,116.2593186,39.88648693
南彩镇其他道路起点至终点段,970,116.717901,40.14086864
北京北路：熊家湾立交桥至夏家店转盘,919,116.4500007,39.92751531
建国路传媒大学南门 东向西,917,116.562709,39.91544705
北京北路外国语小学,932,116.4500007,39.92751531
沙子口路南口北 由南向北,990,116.4120425,39.86737946
北京西路与金阳大道交叉口20米,988,116.4133837,39.91092455
张涿高速涿州方向56KM 425M至76KM 630M,973,116.3069375,39.81933093
魏永路与规划一路交口西向东,976,116.0674571,40.19748493
北京南站南口北 由南向北,943,116.3854879,39.87128024
南河沿大街,983,116.4132077,39.91778294
二广高速474公里350米,915,116.4133837,39.91092455
北京路与孝三路交叉口,975,116.3871828,39.80614577
省道301线(积大线)95公里900米,928,116.4133837,39.91092455
机场第二高速出京方向岗山收费站南侧路段2号点,980,116.6205671,40.04542285
北京市海淀区京新高速箭亭桥北 进京,930,116.3355795,40.0268272
北京市东城区建国门内大街贡院西街南口西 东向西,995,116.4336043,39.91437922
宁海路(北京西路至剑阁路路段),932,116.4133837,39.91092455
兴业大街清源路口 西向东,967,116.319421,39.74953412
五路通街五路通街至德胜门外大街段,998,116.3870211,39.96408439
古城南路与古城小街交叉口 南向北,924,116.1956143,39.91695243
河北省大广高速北京方向1123km+090m,967,116.484938,39.89964808
高梁桥斜街北京交通大学东校区南门东向西,827,116.354168,39.9512491
开阳路北京南站西口南向北,824,116.380814,39.87063205
丰管路泥洼路南口东侧第一个人行横道灯 东向西,887,116.3065983,39.86771757
北京中路武陵大道100米,812,116.4133837,39.91092455
颐和园路颐和园北宫门南向北,841,116.3045612,40.0032825
北京西路与中山北路交叉口,869,116.4133837,39.91092455
北辰西路国家体育场北路西口至北辰西路大屯路口段,827,116.4100474,40.00832027
燕灵路与行宫大街交叉口,886,116.9174712,40.16166229
京沪高速1.6公里处 出京方向,829,116.3069375,39.81933093
京岚线原京福公路(G104)96公里900米至99公里700米区间段由北向南,873,116.4133837,39.91092455
杨庄路与阜南二街交叉口,857,116.2006885,39.92859836
云州街,839,116.4133837,39.91092455
高头寺口至李高丁字口,881,116.4133837,39.91092455
鼓楼西街与西环路路口西向东,880,116.233481,40.2298698
北京市朝阳区荣华桥北 由北向南,829,116.4984394,39.82098982
大连路与北京路路口东西方向,870,116.3871828,39.80614577
北京市丰台区菜户营南路玉泉营桥北天桥 进京,853,116.3452691,39.85520534
西大望路大望桥下口至通惠河北路口段,896,116.4806691,39.9102849
槐房西路公益西桥南第一红绿灯 南向北,813,116.3771496,39.84252198
金沟河路金沟河路中口至金沟河路西口段,836,116.2695897,39.92388892
西直河桥北 由南向北,811,116.5376301,39.84486047
北京路-厦门路,879,116.3871828,39.80614577
北京路与石城路交叉口,854,116.8233593,40.54715618
河北省廊沧高速沧州方向71KM+200M,881,116.3069375,39.81933093
北京市航天中学门前人行灯 东向西,899,116.428441,39.81049407
G101国道与檀西路交叉口 南向北,850,116.8723089,40.38779882
北京路重庆路口（路口电警）,813,116.3871828,39.80614577
二环路阜成门桥内环,867,116.3635083,39.92850287
五环路40公里团河桥内环,848,116.2629365,39.82560764
正义路南口西向东,827,116.4134752,39.91022359
机场辅路大山桥北由北向南,835,116.4951743,39.99463983
